url,titulo,region
https://www.youtube.com/embed/SbNHR13Mwzo,"CNR Mexicali Exigen empresarios a autoridades un alto a la violencia",Mexicali
https://www.youtube.com/embed/WG3Tes06iBI,"CNR Mexicali Hay mucho agua en el valle de mexicali",Mexicali
https://www.youtube.com/embed/dt62yWVX6hg,"CNR Mexicali Propaganda electoral no es reciclable",Mexicali
https://www.youtube.com/embed/aEJDkIaXq4Q,"CNR Mexicali sector maquilador busca opciones para adquirir las dosis de vacunas contra covid",Mexicali
https://www.youtube.com/embed/utswbrhQ3l0,"CNR Mexicali hay mucho agua en el valle de mexicali",Mexicali
https://www.youtube.com/embed/09dkQjW7G2M,"CNR Mexicali el cce sin opinión ante los temas políticos",Mexicali
https://www.youtube.com/embed/-b8I0TJV1Yc,"CNR Mexicali colectivo artístico mexicalense",mexicali